{
  "id": "ram-raksha-stotra",
  "title": "श्री रामरक्षा",
  "language": "sa",
  "script": "Devanagari",
  "category": "stotra",
  "kadhi": "शनिवारी",
  "verification": {
    "status": "draft",
    "verifiedBy": "",
    "verifiedDate": "",
    "sourceCompared": false
  },
  "source": {
    "label": "नित्यसेवा पोथी, पृष्ठ ९ व ९० — फोटोवरून रचना/विनियोग; ३४ श्लोक पूर्ण OCR बाकी.",
    "pages": [
      9,
      90
    ],
    "images": [
      "page-09.jpg",
      "page-90.jpg"
    ]
  },
  "uncertainReadings": [
    {
      "location": "श्लोक १–३४ पूर्ण मजकूर",
      "possibilities": [
        "पृष्ठ ९–९० फोटोवरून"
      ],
      "confidence": "low",
      "requiresHumanReview": true,
      "note": "फोटोत ३४ श्लोक आहेत; या मसुद्यात विनियोग/ध्यान व समाप्ती."
    }
  ],
  "sections": [
    {
      "type": "heading",
      "lines": [
        "१९. ॥ श्री रामरक्षा ॥"
      ]
    },
    {
      "type": "mantra",
      "lines": [
        "॥ श्री गणेशाय नमः ॥"
      ]
    },
    {
      "type": "prose",
      "lines": [
        "अस्य श्रीरामरक्षास्तोत्रमन्त्रस्य बुधकौशिक ऋषिः ।",
        "श्रीसीतारामचन्द्रो देवता । अनुष्टुप् छन्दः ।",
        "सीता शक्तिः । हनुमान् कीलकम् ।",
        "श्रीरामचन्द्रप्रीत्यर्थे जपे विनियोगः ।"
      ]
    },
    {
      "type": "heading",
      "lines": [
        "। अथ ध्यानम् ।"
      ]
    },
    {
      "type": "verse",
      "lines": [
        "ध्यायेदाजानुबाहुं…",
        "[अस्पष्ट: ध्यान पूर्ण ओळी — पृष्ठ ९ फोटोवरून बाकी; स्मृतीने भरलेले नाही]"
      ]
    },
    {
      "type": "note",
      "lines": [
        "। इति ध्यानम् ।"
      ]
    },
    {
      "type": "note",
      "lines": [
        "[अस्पष्ट: मुख्य स्तोत्र श्लोक १–३४ — पृष्ठ ९ फोटोवरून पूर्ण transcription बाकी]",
        "सुरुवात (फोटो): चरितं रघुनाथस्य शतकोटिप्रविस्तरम् ।",
        "समाप्ती (पृष्ठ ९०): ॥ इति श्रीबुधकौशिकविरचितं श्रीरामरक्षास्तोत्रं संपूर्णम् ॥",
        "॥ श्री सीतारामचंद्रार्पणमस्तु ॥ (शनिवारी ही ओळ मारुती स्तोत्रानंतर म्हणावी.)"
      ]
    }
  ]
}
