{
  "id": "valga-sukta",
  "title": "अथर्व वेदोक्त वल्गा सूक्त",
  "language": "mixed",
  "script": "Devanagari",
  "category": "sukta",
  "kadhi": "",
  "verification": {
    "status": "draft",
    "verifiedBy": "",
    "verifiedDate": "",
    "sourceCompared": false
  },
  "source": {
    "label": "नित्यसेवा पोथी, पृष्ठ ३",
    "pages": [3],
    "images": ["page-3-photo.jpg"]
  },
  "uncertainReadings": [
    {
      "location": "श्लोक ७, पहिली ओळ — 'चक्रुरिष्वायुधे' मधील 'रु'",
      "possibilities": ["चक्रुरिष्वायुधे"],
      "confidence": "high",
      "requiresHumanReview": true,
      "note": "आधीच्या AI transcription मध्ये Latin 'u' (चक्रuरिष्वायुधे) आला होता. फोटोत स्पष्टपणे देवनागरी 'रु' दिसत आहे. तरीही मानवी पडताळणीसाठी नोंद ठेवली आहे."
    },
    {
      "location": "श्लोक १०, पहिली ओळ — 'प्रहिण्मसि' मधील 'हि'",
      "possibilities": ["प्रहिण्मसि"],
      "confidence": "high",
      "requiresHumanReview": true,
      "note": "आधीच्या AI transcription मध्ये Latin 'h' (प्रhिण्मसि) आला होता. फोटोत स्पष्टपणे देवनागरी 'हि' दिसत आहे. तरीही मानवी पडताळणीसाठी नोंद ठेवली आहे."
    }
  ],
  "sections": [
    { "type": "heading", "lines": ["११. ॥ अथर्व वेदोक्त वल्गा सूक्त ॥"] },
    { "type": "mantra", "lines": ["॥ श्री स्वामी समर्थ ॥"] },
    { "type": "verse", "number": "१", "lines": ["यां ते चक्रुरामे पात्रे, यां चक्रुमिश्र - धान्ये,", "आमे मांसे कृत्यां यां चक्रुः, पुनः प्रति हरामि ताम् ॥१॥"] },
    { "type": "verse", "number": "२", "lines": ["यां ते चक्रुः कृक - वाका, वजे वा यां कुरीरिणि,", "अव्यां ते कृत्यां यां चक्रुः, पुनः प्रति हरामि ताम् ॥२॥"] },
    { "type": "verse", "number": "३", "lines": ["यां ते चक्रुरेक - शफे, पशुनामुभयादति,", "गर्दभे कृत्यां यां चक्रुः, पुनः प्रति हरामि ताम् ॥३॥"] },
    { "type": "verse", "number": "४", "lines": ["यां ते चक्रुरमूलयां, वलगं वा नराच्याम्,", "क्षेत्रे ते कृत्यां यां चक्रुः, पुनः प्रति हरामि ताम् ॥४॥"] },
    { "type": "verse", "number": "५", "lines": ["यां ते चक्रुर्गाहर्पत्ये, पूर्वाग्नावुत दुश्चितः,", "शालायां कृत्यां यां चक्रुः, पुनःप्रति हरामि ताम् ॥५॥"] },
    { "type": "verse", "number": "६", "lines": ["यां ते चक्रुः सभायां, यां चक्रुरधिदेवते,", "अक्षेषु कृत्यां यां चक्रुः, पुनः प्रति हरामि ताम् ॥६॥"] },
    { "type": "verse", "number": "७", "lines": ["यां ते चक्रुः सेनायां, यां चक्रुरिष्वायुधे,", "दुंदुभौ कृत्यां यां चक्रुः, पुनः प्रति हरामि ताम् ॥७॥"] },
    { "type": "verse", "number": "८", "lines": ["यां ते कृत्यां कूपे वदधुः, स्मशाने वा निचरन्नुः,", "सद्मनि कृत्यां यां चक्रुः, पुनः प्रति हरामि ताम् ॥८॥"] },
    { "type": "verse", "number": "९", "lines": ["यां ते चक्रुः पुरुषस्यास्थे, अग्नौ संकसुके च याम्,", "भ्रोकं निदांहं क्रव्यादं, पुनः प्रति हरामि ताम् ॥९॥"] },
    { "type": "verse", "number": "१०", "lines": ["अपथैनाज - भारैणा, तां पथेतः प्रहिण्मसि,", "अधीरो मर्यो धीरेभ्यः, संजभाराचित्या ॥१०॥"] },
    { "type": "verse", "number": "११", "lines": ["यक्ष्कार न शशाक, कर्तुं शश्रे पादमंगुरिम्,", "चकार भद्रस्मभ्यमभगो भगवद्भ्यः ॥११॥"] },
    { "type": "verse", "number": "१२", "lines": ["कृत्यां कृतं वलगिनं मूलिनं शपथेऽय्यम्,", "इन्द्रस्तं हंतुमहता, बघेनाग्नि र्विध्यत्वस्तया ॥१२॥"] },
    { "type": "heading", "lines": ["या सूक्ताचे महत्त्व :-"] },
    { "type": "prose", "lines": [
      "१. या सूक्ताचे घरामध्ये, घराच्या प्रांगणात, धान्याद्वारे, पशुद्वारा,",
      "शेतीत, आकाशमार्गे, सभेच्या ठिकाणी, शस्त्राद्वारे,",
      "स्मशानात, स्मशानहाडाद्वारे, अग्निद्वारा, जलद्वारा इ.सर्व",
      "प्रकारे केलेली करणी, बाधा, अभिचार निवारण होतात व",
      "सूक्ताचे शेवटी दिलेली शपथ, ती केलेली करणी, अभिचार,",
      "अग्नी भस्म करतो व इंद्र त्या करणी करणाऱ्याचा नाश करतो."
    ] },
    { "type": "prose", "lines": [
      "२. अतिभयंकर रोग जे आधुनिक निष्णात डॉक्टरही बरे करु",
      "शकत नाही, असे रोगही या सूक्ताने बरे होऊ शकतात."
    ] },
    { "type": "prose", "lines": ["३. जनावरांच्यावरील करणी ही या सूक्ताने निवारण होते."] },
    { "type": "prose", "lines": ["४. भयंकर भूतप्रेत बाधेचेही याने निवारण होते."] },
    { "type": "prose", "lines": [
      "५. गंभीर संभाव्य अपघातातूनही वाहनाचे व स्वतःचे संरक्षण",
      "करता येते."
    ] },
    { "type": "prose", "lines": ["६. ज्याचे मनोबल पूर्ण खच्ची झाले आहे तेही निवारण होऊ शकते."] },
    { "type": "prose", "lines": ["७. घरातील अशुभ शक्तींच्या उपद्रवापासून संरक्षण करता येते."] },
    { "type": "note", "lines": ["(विधी करण्यासाठी पुस्तकामधील नियम वाचावेत.)"] }
  ]
}
