{
  "id": "kalbhairav-ashtak",
  "title": "श्री कालभैरवाष्टक",
  "language": "sa",
  "script": "Devanagari",
  "category": "stotra",
  "kadhi": "",
  "verification": {
    "status": "draft",
    "verifiedBy": "",
    "verifiedDate": "",
    "sourceCompared": false
  },
  "source": {
    "label": "नित्यसेवा पोथी, पृष्ठ ७–८ — फोटोवरून AI transcription; अद्याप मानवी सेवेकऱ्याकडून मूळ पुस्तकाशी पडताळणी झालेली नाही (sourceCompared=false).",
    "pages": [7, 8],
    "images": ["page-07.jpg", "page-08.jpg"]
  },
  "uncertainReadings": [
    {
      "location": "श्लोक ५–८ व फलश्रुती (पृष्ठ ८)",
      "possibilities": ["पूर्ण मजकूर फोटोवरून पुन्हा उतरवायचा"],
      "confidence": "low",
      "requiresHumanReview": true,
      "note": "या मसुद्यात फक्त पृष्ठ ७ वरील श्लोक १–४ पूर्ण आहेत. ५–८ व फलश्रुती फक्त सुरुवातीच्या ओळींवरून ओळखल्या; पूर्ण पाठ अजून उतरवलेला नाही."
    }
  ],
  "sections": [
    { "type": "heading", "lines": ["१६. ॥ श्री कालभैरवाष्टक ॥"] },
    { "type": "mantra", "lines": ["॥ श्री गणेशाय नमः ॥"] },
    { "type": "verse", "number": "१", "lines": [
      "देवराजसेव्यमान पावनांघ्रि पंकजं ।",
      "व्यालयज्ञ सूत्रमिन्दुशेखरं कृपा करम् ॥",
      "नारदादियोगिवृन्दवन्दितं दिगंबरम् ।",
      "काशिकापुराधिनाथ कालभैरवं भजे ॥१॥"
    ] },
    { "type": "verse", "number": "२", "lines": [
      "भानुकोटी भास्वरं भवाब्धि तारकं परम् ।",
      "नीलकण्ठमीप्सितार्थदायकं त्रिलोचनम् ॥",
      "कालकालमम्बुजाक्षमक्षशूलमक्षरम् ।",
      "काशिकापुराधिनाथ कालभैरवं भजे ॥२॥"
    ] },
    { "type": "verse", "number": "३", "lines": [
      "शूलटंकपाशदण्डपाणिमादिकारणम् ।",
      "श्यामकायमादिदेवमक्षरं निरामयम् ॥",
      "भीमविक्रमं प्रभुं विचित्रताण्डव प्रियम् ।",
      "काशिकापुराधिनाथ कालभैरवं भजे ॥३॥"
    ] },
    { "type": "verse", "number": "४", "lines": [
      "भुक्तिमुक्तिदायकं प्रशस्तचारुविग्रहम् ।",
      "भक्तवत्सलं स्थितं समस्तलोक विग्रहम् ॥",
      "विनिक्वणन्मनोज्ञहेमकिंकिणील सत्कटीम् ।",
      "काशिकापुराधिनाथ कालभैरवं भजे ॥४॥"
    ] },
    { "type": "note", "lines": [
      "[अस्पष्ट: श्लोक ५–८ व फलश्रुती — पृष्ठ ८ फोटोवरून पूर्ण transcription बाकी]",
      "समाप्ती (फोटो वर्णन): ॥ इति श्रीमच्छंकराचार्य विरचितं कालभैरवाष्टकं संपूर्णम् ॥ ॥ श्री अस्तु ॥"
    ] }
  ]
}
