{
  "id": "ishwar-prarthana",
  "title": "ईश्वर प्रार्थना",
  "language": "mixed",
  "script": "Devanagari",
  "category": "prarthana",
  "kadhi": "",
  "verification": {
    "status": "draft",
    "verifiedBy": "",
    "verifiedDate": "",
    "sourceCompared": false
  },
  "source": {
    "label": "नित्यसेवा पोथी, पृष्ठ ३ — फोटोवरून AI transcription; अद्याप मानवी सेवेकऱ्याकडून मूळ पुस्तकाशी पडताळणी झालेली नाही (sourceCompared=false).",
    "pages": [3],
    "images": []
  },
  "uncertainReadings": [
    {
      "location": "ईश्वर प्रार्थना क्रमांक २ — महेश्वरः नंतरचे चिन्ह",
      "possibilities": ["।", "ः", ":"],
      "confidence": "low",
      "requiresHumanReview": true
    },
    {
      "location": "ईश्वर प्रार्थना क्रमांक २ — तस्मै श्रीगुरवे नमः नंतरचे चिन्ह",
      "possibilities": ["।", "ः", ":"],
      "confidence": "low",
      "requiresHumanReview": true
    },
    {
      "location": "ईश्वर प्रार्थना क्रमांक १ मराठी भाषांतर — तेजस्वरुपाः नंतरचे चिन्ह",
      "possibilities": ["ः", ":"],
      "confidence": "low",
      "requiresHumanReview": true
    }
  ],
  "sections": [
    { "type": "mantra", "lines": ["॥ श्री स्वामी समर्थ ॥"] },
    { "type": "verse", "lines": ["१. ॐ भूर्भवः स्वः तत्सवितुर्वरेण्यं भर्गो देवस्य धीमहि धियो योनः प्रचोदयात् । (ऋग्वेद-३-६२-१०)"] },
    { "type": "prose", "lines": ["हे ईश्वरा, सर्वश्रेष्ठ तेजस्वरुपाः आम्ही सर्व तुझे ध्यान करतो। आम्हा सर्वांच्या बुद्धीस सन्मार्ग व शुभ कार्यासाठी प्रज्वलित कर।"] },
    { "type": "verse", "lines": ["२. ॐ गुरुर्ब्रम्हः गुरुर्विष्णुः गुरुर्देवो महेश्वरः । गुरुः साक्षात् परब्रम्हः तस्मै श्रीगुरवे नमः । (गुरुगीता)"] },
    { "type": "prose", "lines": ["हे ईश्वरा, विश्वाच्या सर्व दुःखावर विजयाचा मार्ग दाखविणारा गुरुच ब्रम्हा होय; तोच विश्व व्यापक, सर्वज्ञ विष्णु व महादेव होय; परमसत्याचा मार्ग दाखविणारा गुरु साक्षात परब्रम्ह होय, तुला आम्ही नमन करतो।"] },
    { "type": "mantra", "lines": ["३. ॐ नमः शिवाय । ॐ नमः शिवाय ॥ ॐ नमः शिवाय ॥"] },
    { "type": "prose", "lines": ["हे ईश्वरा, आम्ही तुला प्रणाम करतो।"] },
    { "type": "verse", "lines": ["४. हे गुरुदेव, हम सबको सद्बुद्धि दें। सत्कर्तव्य करने की प्रवृत्ति दें। सच बोलने का अभ्यास दें। सत्स्वरुप का ज्ञान दें।"] },
    { "type": "prose", "lines": ["हे ईश्वरा, आम्हा सर्वांस सद्बुद्धी दे। सत्कार्य करण्याची प्रेरणा दे। खरे बोलण्याचा अभ्यास दे। तुझ्या सत्य स्वरुपाचे ज्ञान दे !"] },
    { "type": "mantra", "lines": ["५. ॐ नमः शिवाय । ॐ नमः शिवाय ॥ ॐ नमः शिवाय ॥"] },
    { "type": "prose", "lines": ["हे ईश्वरा, आम्ही तुला प्रणाम करतो।"] },
    { "type": "verse", "lines": ["६. ॐ त्वमेव माताच पिता त्वमेव, त्वमेव बंधुश्च सखा त्वमेव । त्वमेव विद्या द्रविणं त्वमेव, त्वमेव सर्वं मम देवदेव ॥"] },
    { "type": "prose", "lines": ["हे ईश्वरा, तूच आमची माता व पिता आहेस। तूच बंधू व मित्रही आहेस। तूच आमची विद्या व धन आहेस। तूच आमचे सर्वस्व आहेस।"] },
    { "type": "verse", "lines": ["७. है प्रार्थना गुरुदेव से यह स्वर्गसम् संसार हो, अतिउच्चतम् जीवन बने, परमार्थमय व्यवहार हो। ना हम राहें अपने लिए, हमको सभी से गर्ज है, गुरुदेव यह आशीष दें, जो सोचने का फर्ज हैं।"] },
    { "type": "prose", "lines": ["हे ईश्वरा, हे विश्व स्वर्गासारखे होवो, आम्हा सर्वांचे जीवन सर्वोत्तम होवो आणि आपापसातील व्यवहार हा ईश्वरी व्यवहार ठरो व आम्ही निःस्वार्थी व परोपकारी बनो असा आशीर्वाद दे।"] },
    { "type": "verse", "lines": ["८. हम हो पुजारी तत्व के, गुरुदेव के आदेश के, सच प्रेम के नीत नेम के, सद्धर्म के सत्कर्म के। हो चीड झूठी राह की, अन्याय की अभिमान की, सेवा करने को दास की, परवाह नही हो जान की ॥"] },
    { "type": "prose", "lines": ["हे ईश्वरा। आम्हा सर्वांचे जीवन प्रेम, सचोटी, सत्कार्य, सद्धर्माने प्रेरीत कर। आमचे मनात अन्याय-अहंकारा विषयी तिरस्कार निर्माण कर व त्यापासून परावृत्त कर। आमचे जीवन उज्ज्वल होवू दे, अन् उपेक्षितांची सेवा घडू दे।"] }
  ]
}
