{
  "id": "rudradhyaya",
  "title": "रुद्राध्याय (नमक–चमक)",
  "language": "sa",
  "script": "Devanagari",
  "category": "stotra",
  "kadhi": "सोमवारी",
  "verification": {
    "status": "draft",
    "verifiedBy": "",
    "verifiedDate": "",
    "sourceCompared": false
  },
  "source": {
    "label": "नित्यसेवा पोथी, पृष्ठ १४–१७ — फोटोवरून आंशिक (अनुवाक सुरुवाती); पूर्ण वेदपाठ OCR बाकी. स्मृतीने भरू नये.",
    "pages": [14, 15, 16, 17],
    "images": ["page-14.jpg", "page-15.jpg", "page-16.jpg", "page-17.jpg"]
  },
  "uncertainReadings": [
    {
      "location": "नमक अनुवाक १–११ व चमक १–११ पूर्ण",
      "possibilities": ["पृष्ठ १४–१७ फोटोवरून अक्षरशः"],
      "confidence": "low",
      "requiresHumanReview": true,
      "note": "या मसुद्यात फक्त फोटो वर्णनातील सुरुवाती/शीर्षके; संपूर्ण रुद्र स्मृतीने टाकलेले नाही."
    }
  ],
  "sections": [
    { "type": "heading", "lines": ["३३. ॥ रुद्राध्यायः ॥"] },
    { "type": "heading", "lines": ["नमक अनुवाक — यादी (पूर्ण पाठ फोटोवरून बाकी)"] },
    { "type": "note", "lines": [
      "अनुवाक ९ सुरुवात (पृ. १४ फोटो): हरि ॐ नमस्ते रुद्र मन्यव उतो त इषवे नमः ।",
      "अनुवाक २ सुरुवात (पृ. ९५): नमो हिरण्यबाहवे सेनान्ये दिशां च पतये नमो…",
      "अनुवाक ३: नम: सहमानाय निव्याधिन आ व्याधिनीनां पतये नमो…",
      "अनुवाक ४: नम आव्याधिनीभ्यो विविध्यन्तीभ्यश्च वो नमो…",
      "अनुवाक ५: नमो भवाय च रुद्राय च…",
      "अनुवाक ६: नमो ज्येष्ठाय च कनिष्ठाय च…",
      "अनुवाक ७: नमो दुन्दुभाय चाहनन्याय च…",
      "अनुवाक ८: नम: सोमाय च रुद्राय च…",
      "अनुवाक ९ (पृ. १६): नम इरिण्याय च प्रपथ्याय च ॥१॥…",
      "अनुवाक १०: द्रापे अन्धसस्पते दरिद्रन्नीललोहित ।…",
      "अनुवाक ११: सहस्राणि सहस्रशो ये रुद्रा अधि भूम्याम्…"
    ] },
    { "type": "mantra", "lines": [
      "ॐ त्र्यंबकं यजामहे । सुगंधिं पुष्टिवर्धनं ।",
      "उर्वारुकमिव बंधनान् मृत्योर्मुक्षीय मामृतात् ॥"
    ] },
    { "type": "heading", "lines": ["चमक अनुवाक — यादी (पूर्ण पाठ फोटोवरून बाकी)"] },
    { "type": "note", "lines": [
      "चमक १: ॐ अग्नाविष्णू सजोहसे मा वर्धन्तु वां गिरः ।… मे शरीराणि च मे ॥१॥",
      "चमक २: ज्यैष्ठ्यं च म आधिपत्यं च… मे सुमतिश्च मे ॥२॥",
      "चमक ३: शं च मे मयश्च मे प्रियं च… मे सुदिनं च मे ॥३॥",
      "चमक ४: ऊर्क्च मे सूनृता च मे पयश्च मे… नीवाराश्च मे ॥४॥",
      "चमक ५: अश्मा च मे मृत्तिका च मे… ॥५॥",
      "चमक ६: अग्निश्च मे इन्द्रश्च मे सोमश्च मे… ॥६॥",
      "चमक ७–११: [अस्पष्ट: पूर्ण — पृष्ठ १७ फोटोवरून]",
      "समाप्ती (फोटो): ॥ इति रुद्राध्याय: समाप्त: ॥"
    ] }
  ]
}
