{
  "id": "pothi-batch-inventory",
  "title": "पोथी फोटो बॅच — बाकी रचना (यादी)",
  "language": "mixed",
  "script": "Devanagari",
  "category": "other",
  "kadhi": "",
  "verification": {
    "status": "draft",
    "verifiedBy": "",
    "verifiedDate": "",
    "sourceCompared": false
  },
  "source": {
    "label": "नित्यसेवा पोथी फोटो बॅच (पृष्ठ ५–२०, ९०, ९३–९५ इ.) — फक्त यादी; पूर्ण मजकूर नंतर फोटोवरून draft करायचा. public-index मध्ये जोडू नये.",
    "pages": [5, 6, 7, 8, 9, 11, 12, 14, 16, 17, 18, 19, 20, 90, 93, 95],
    "images": []
  },
  "uncertainReadings": [
    {
      "location": "संपूर्ण बॅच",
      "possibilities": ["प्रत्येक रचना वेगळ्या draft फाईलमध्ये पूर्ण transcription नंतर"],
      "confidence": "low",
      "requiresHumanReview": true,
      "note": "ही फाईल मजकूर नाही — फक्त काय बाकी आहे याची यादी."
    }
  ],
  "sections": [
    { "type": "heading", "lines": ["या बॅचमध्ये फोटो आले; draft सुरू / बाकी"] },
    { "type": "prose", "lines": [
      "पूर्ण/आंशिक draft तयार: पर्जन्यसूक्त, कालभैरवाष्टक (१–४), करुणाष्टके (आंशिक),",
      "शिवमहिम्न मराठी (११–३२), शिवनामावली (१–४४), नवग्रह स्तोत्र, ऐक्य मंत्र."
    ] },
    { "type": "prose", "lines": [
      "अजून वेगळे draft करायचे (फोटो स्पष्ट, पूर्ण OCR बाकी):",
      "१५ श्री सूक्त · १७ महाकाली स्तोत्र · १९ श्री रामरक्षा · २० मारुती स्तोत्र (शनिवारी) ·",
      "२१ चरणीं ठाव घावा (तुकाराम) · २२ पसायदान · ३१ द्वादश ज्योतिर्लिंग ·",
      "३३ रुद्राध्याय / नमक-चमक · ३४ पुरुषसूक्त · ३६ लांगूलास्त्र स्तोत्र ·",
      "ध्यान मंत्र / सामुदायिक प्रार्थना / सोमवार शिवसेवा छोटे मंत्र."
    ] },
    { "type": "note", "lines": [
      "नियम: public-index.json मध्ये visibility=test किंवा verified नोंद",
      "फक्त मानवी चेक झाल्यावरच जोडावी (Print: नंतर check झाले की add करू)."
    ] }
  ]
}
