{
  "id": "shivkavach-prakrit",
  "title": "शिवकवच (प्राकृत)",
  "language": "mr",
  "script": "Devanagari",
  "category": "stotra",
  "kadhi": "",
  "verification": {
    "status": "draft",
    "verifiedBy": "",
    "verifiedDate": "",
    "sourceCompared": false
  },
  "source": {
    "label": "नित्यसेवा पोथी संपूर्ण स्कॅन (nityaseava_scan_7_aug.pdf) — मुद्रित पृष्ठ ९६-९९ वरून; AI ने प्रथमच उतरवले.",
    "pages": [
      96,
      97,
      98,
      99
    ],
    "images": [
      "nityaseava_scan_7_aug.pdf pages 5-10"
    ]
  },
  "uncertainReadings": [
    {
      "location": "श्लोक ३० नंतर — 'इति' समाप्तीची ओळ",
      "possibilities": [
        "वापरकर्त्याने पाठवलेल्या पहिल्या २० पानांत श्लोक ३० नंतर स्तोत्र संपल्याची स्पष्ट खूण (इति) दिसली नाही — पुढे आणखी श्लोक असू शकतात. पान २१ पासूनचा फोटो/स्कॅन मिळाल्यावर तपासावे."
      ],
      "confidence": "medium",
      "requiresHumanReview": true
    }
  ],
  "sections": [
    {
      "type": "heading",
      "lines": [
        "शिवकवच (प्राकृत)"
      ]
    },
    {
      "type": "verse",
      "number": "१",
      "lines": [
        "वज्रदाढा, कंठ काळा, त्या शत्रूविनाशकासी नमन ।",
        "अतिउग्र सहस्त्रकर त्या उमापती शंभूस वंदन ॥१॥"
      ]
    },
    {
      "type": "verse",
      "number": "२",
      "lines": [
        "पुराण गुह्य तू पापविनाशी पवित्र शुभंकर ।",
        "जयकारी संकट-हारी वर्णितो शिवकवच हितकर ॥२॥"
      ]
    },
    {
      "type": "heading",
      "lines": [
        "ऋषभ म्हणाला —"
      ]
    },
    {
      "type": "verse",
      "number": "३",
      "lines": [
        "नमस्कार महादेवा तुझ्या विश्वव्यापी रूपास सदा ।",
        "शिव गुपित हे सांगतो रक्षी मानवा वरद सदा ॥३॥"
      ]
    },
    {
      "type": "verse",
      "number": "४",
      "lines": [
        "पवित्र भूमिवरी बैसीजे मांडोनी स्थिर आसन ।",
        "इंद्रिय निग्रह प्राणायाम साधोनी करी शिवध्यान ॥४॥"
      ]
    },
    {
      "type": "verse",
      "number": "५",
      "lines": [
        "हृदय निवासी स्वतेजोकाशी व्याप्त शिवशंकरा ।",
        "अतिंद्रिय-सूक्ष्म अनंत ध्यावे परमानंद गिरिवरा ॥५॥"
      ]
    },
    {
      "type": "heading",
      "lines": [
        "शिवरक्षा मंत्र"
      ]
    },
    {
      "type": "verse",
      "number": "६",
      "lines": [
        "त्यजोनी कर्म बंधने सारी चिदानंदी ठेवी मन ।",
        "जपोनी शिवमंत्र षडाक्षरी करी स्व-संरक्षण ॥६॥"
      ]
    },
    {
      "type": "verse",
      "number": "७",
      "lines": [
        "रक्षोत देव मजला या भवसागरी ।",
        "पाप नाश हो हृदयी मूळ मंत्राने सत्वरी ॥७॥"
      ]
    },
    {
      "type": "verse",
      "number": "८",
      "lines": [
        "विश्वमूर्ति जोतिर्मय सच्चिदात्मा आनंदधन रक्षा कर ।",
        "अणूरेणूत सर्वत्र जी शक्ती निर्भय करी सत्वर ॥८॥"
      ]
    },
    {
      "type": "verse",
      "number": "९",
      "lines": [
        "भूतली रक्षी अष्टमूर्ति तू हे गिरीश शंकरा ।",
        "नवजीवन जळे देशी जलापासोनी रक्षी त्वरा ॥९॥"
      ]
    },
    {
      "type": "verse",
      "number": "१०",
      "lines": [
        "कल्पांती जग भस्म करिशी तांडव योगेश्वरा ।",
        "वडवानल वायु पासोनी रक्षी काल रूद्र गिरिवरा ॥१०॥"
      ]
    },
    {
      "type": "verse",
      "number": "११",
      "lines": [
        "विद्युत सुवर्णासम कांती तुझी विद्यावर परशुधरा ।",
        "चतुर्मुख त्रिनेत्र भयंकर पुरुषा पूर्वेस रक्षण करा ॥११॥"
      ]
    },
    {
      "type": "verse",
      "number": "१२",
      "lines": [
        "परशु वेदांकुश पाश शूल कवटी डमरू अक्षधरा ।",
        "चतुर्मुख सुंदर निलत्रिनेत्रा दक्षिणेस रक्षण करा ॥१२॥"
      ]
    },
    {
      "type": "verse",
      "number": "१३",
      "lines": [
        "कंदपुष्प चंद्रशंख स्फटिक वेदाक्षमाला करी धारण ।",
        "अभय हस्त त्रिनेत्र चतुर्मुख योद्धा पश्चिमेस करी रक्षण ॥१३॥"
      ]
    },
    {
      "type": "verse",
      "number": "१४",
      "lines": [
        "परशू माला वर्ण कमल पुष्प तंतू कर ।",
        "त्रिनेत्र चतुर्मुख वामदेवा उत्तरेस रक्षा कर ॥१४॥"
      ]
    },
    {
      "type": "verse",
      "number": "१५",
      "lines": [
        "वेदांकुश पाशपरशू कवटी शूलाक्ष डमरू अभयवरदा ।",
        "पंचमुखी चांदरात्री सम तेजस, अंतराळातूनी रक्षी सदा ॥१५॥"
      ]
    },
    {
      "type": "verse",
      "number": "१६",
      "lines": [
        "चंद्रमौली मस्तक रक्षी कपाल भालनेत्रेश्वरा ।",
        "मदनहारी नेत्ररक्षी नासिकाग्र विश्वंभरा ॥१६॥"
      ]
    },
    {
      "type": "verse",
      "number": "१७",
      "lines": [
        "कीर्ती गाती श्रुति ज्याची कानरक्षी कवटीधारी गालची ।",
        "पंचमुख मुख रक्षो वेदजिव्हा जिभेसची ॥१७॥"
      ]
    },
    {
      "type": "verse",
      "number": "१८",
      "lines": [
        "निलकंठ गळा रक्षो धनुर्धर द्वय हस्तची ।",
        "धर्मबाहु भुजा रक्षो यज्ञ वक्षस्थलची ॥१८॥"
      ]
    },
    {
      "type": "verse",
      "number": "१९",
      "lines": [
        "गिरीधनुर्धारी उदर रक्षो मदनहारी मध्य अंगची ।",
        "गणेशपिता नाभि रक्षो धूर्जटी कमरेसची ॥१९॥"
      ]
    },
    {
      "type": "verse",
      "number": "२०",
      "lines": [
        "कुबेर मित्र गुडघे रक्षो जगदीश्वर मांड्यासची ।",
        "बैलध्वज जांघा रक्षो देवां चरणवंद्य जो रक्षी पायासची ॥२०॥"
      ]
    },
    {
      "type": "verse",
      "number": "२१",
      "lines": [
        "महेश्वर दिनारंभी रक्षो वामदेव मध्य प्रहरी ।",
        "त्रिलोचना तृतीय प्रहरी रक्षो वृषध्वज अंत:प्रहरी ॥२१॥"
      ]
    },
    {
      "type": "verse",
      "number": "२२",
      "lines": [
        "रात्रारंभी शशिशेखर रक्षो गंगाधर मध्यरात्री ।",
        "गौरीपती पहाट समयी मृत्युंजय सदा दिन रात्री ॥२२॥"
      ]
    },
    {
      "type": "verse",
      "number": "२३",
      "lines": [
        "अंतरी रक्षी शिवशंकर बाह्यांतरी हि शंकर ।",
        "मधोमध पशुपती रक्षो सर्वत्र सदाशिवहर ॥२३॥"
      ]
    },
    {
      "type": "verse",
      "number": "२४",
      "lines": [
        "स्थळी भुवनैकनाथ रक्षो प्रवासी प्रमथाधिनाथ ।",
        "बैठकी वेदांतवेद्य रक्षो सुषुप्तीत शंभोनाथ ॥२४॥"
      ]
    },
    {
      "type": "verse",
      "number": "२५",
      "lines": [
        "मार्गात निलकंठ रक्षी गिरीत त्रिपुरारी ।",
        "महारण्ये प्रवासे उदारशक्ती मृगव्याध तारी ॥२५॥"
      ]
    },
    {
      "type": "verse",
      "number": "२६",
      "lines": [
        "प्रलयंकर गर्विष्ठ रौद्र विकटहास्य ब्रह्मांडव्यापका ।",
        "शत्रूविनाशीता वीरभद्रा रक्षी महाभयी भयांतका ॥२६॥"
      ]
    },
    {
      "type": "verse",
      "number": "२७",
      "lines": [
        "अश्व गज रथ कवचधारी सहस्त्रलक्ष सैन्यावरी ।",
        "शत औक्षहिणी दुष्ट सैन्या परशुने ठार करी ॥२७॥"
      ]
    },
    {
      "type": "verse",
      "number": "२८",
      "lines": [
        "प्रलयांतका ज्वालांतका असुर मर्दिशी त्रिशूलाने त्रिपुरांतका ।",
        "वाघ सिंह कोल्हा हिंस्र पशूस पळवी धनुर्धारी पिनाका ॥२८॥"
      ]
    },
    {
      "type": "verse",
      "number": "२९",
      "lines": [
        "दुःस्वप्न दुःशकुन दुर्गति दुष्टपणा ।",
        "दुर्भिक्ष दुर्व्यसन दुःखे नाशिसी सर्वनाशना ॥२९॥"
      ]
    },
    {
      "type": "verse",
      "number": "३०",
      "lines": [
        "उत्पात ताप विषभीती पीडा पापग्रह तदा ।",
        "नाशिसी सर्व मम व्याधी जगदीशा सर्वदा ॥३०॥"
      ]
    }
  ]
}