{
  "id": "shree-sukta",
  "title": "श्रीसूक्तम्",
  "language": "sa",
  "script": "Devanagari",
  "category": "sukta",
  "kadhi": "",
  "verification": {
    "status": "draft",
    "verifiedBy": "",
    "verifiedDate": "",
    "sourceCompared": false
  },
  "source": {
    "label": "अपलोड: shree_suktam.txt (2026-08-05) — जुना आंशिक मसुदा या फाइलने replace",
    "pages": [
      7
    ],
    "images": [
      "uploads-2026-08-05/shree-suktam.txt"
    ]
  },
  "uncertainReadings": [
    {
      "location": "पूर्ण श्रीसूक्त — अपलोड .txt",
      "possibilities": [
        "source/pothi/uploads-2026-08-05/shree-suktam.txt अक्षरशः"
      ],
      "confidence": "medium",
      "requiresHumanReview": true,
      "note": "२७ श्लोक + शान्तिपाठ. काही ओळींमध्ये असामान्य रूपे (उदा. जातवेदो म आवह, कांसोस्मितां, जुहुयाादाज्य) — मूळ पोथी/प्रमाण पाठशी मानवी ताडा आवश्यक. स्मृतीने दुरुस्त केलेले नाही."
    }
  ],
  "sections": [
    {
      "type": "heading",
      "lines": [
        "॥ श्रीसूक्तम् ॥"
      ]
    },
    {
      "type": "mantra",
      "lines": [
        "॥ हरि: ॐ ॥"
      ]
    },
    {
      "type": "verse",
      "number": "१",
      "lines": [
        "ॐ हिरण्यवर्णाम हरिणीं सुवर्णरजतस्रजाम्।",
        "चन्द्रां हिरण्मयीं लक्ष्मीं जातवेदो म आवह ॥१॥"
      ]
    },
    {
      "type": "verse",
      "number": "२",
      "lines": [
        "तां म आवह जातवेदो लक्ष्मीमनपगामिनीम्।",
        "यस्यां हिरण्यं विन्देयं गामश्वं पुरुषानहम् ॥२॥"
      ]
    },
    {
      "type": "verse",
      "number": "३",
      "lines": [
        "अश्वपूर्वां रथमध्यां हस्तिनादप्रबोधिनीम्।",
        "श्रियं देवीमुपह्वये श्रीर्मादेवी जुषताम् ॥३॥"
      ]
    },
    {
      "type": "verse",
      "number": "४",
      "lines": [
        "कांसोस्मितां हिरण्यप्राकारां आद्रां ज्वलन्तीं तृप्तां तर्पयन्तीम्।",
        "पद्मेस्थितां पद्मवर्णां तामिहोपह्वयेश्रियम् ॥४॥"
      ]
    },
    {
      "type": "verse",
      "number": "५",
      "lines": [
        "चन्द्रां प्रभासां यशसा ज्वलन्तीं श्रियंलोके देव जुष्टामुदाराम्।",
        "तां पद्मिनीमीं शरणमहं प्रपद्येऽलक्ष्मीर्मे नश्यतां त्वां वृणे ॥५॥"
      ]
    },
    {
      "type": "verse",
      "number": "६",
      "lines": [
        "आदित्यवर्णे तपसोऽधिजातो वनस्पतिस्तववृक्षोथ बिल्व:।",
        "तस्य फलानि तपसानुदन्तु मायान्तरायाश्च बाह्या अलक्ष्मी: ॥६॥"
      ]
    },
    {
      "type": "verse",
      "number": "७",
      "lines": [
        "उपैतु मां देवसख: कीर्तिश्चमणिना सह।",
        "प्रादुर्भुतो सुराष्ट्रेऽस्मिन् कीर्तिमृध्दिं ददातु मे ॥७॥"
      ]
    },
    {
      "type": "verse",
      "number": "८",
      "lines": [
        "क्षुत्पपासामलां जेष्ठां अलक्ष्मीं नाशयाम्यहम्।",
        "अभूतिमसमृध्दिं च सर्वानिर्णुद मे गृहात ॥८॥"
      ]
    },
    {
      "type": "verse",
      "number": "९",
      "lines": [
        "गन्धद्वारां दुराधर्षां नित्यपुष्टां करीषिणीम्।",
        "ईश्वरिं सर्वभूतानां तामिहोपह्वये श्रियम् ॥९॥"
      ]
    },
    {
      "type": "verse",
      "number": "१०",
      "lines": [
        "मनस: काममाकूतिं वाच: सत्यमशीमहि।",
        "पशूनां रूपमन्नस्य मयि श्री: श्रेयतां यश: ॥१०॥"
      ]
    },
    {
      "type": "verse",
      "number": "११",
      "lines": [
        "कर्दमेनप्रजाभूता मयिसंभवकर्दम।",
        "श्रियं वासयमेकुले मातरं पद्ममालिनीम् ॥११॥"
      ]
    },
    {
      "type": "verse",
      "number": "१२",
      "lines": [
        "आप स्रजन्तु सिग्धानि चिक्लीत वस मे गृहे।",
        "नि च देवीं मातरं श्रियं वासय मे कुले ॥१२॥"
      ]
    },
    {
      "type": "verse",
      "number": "१३",
      "lines": [
        "आर्द्रां पुष्करिणीं पुष्टि पिङ्गलां पद्ममालिनीम्।",
        "चन्द्रां हिरण्मयीं लक्ष्मीं जातवेदो म आवह ॥१३॥"
      ]
    },
    {
      "type": "verse",
      "number": "१४",
      "lines": [
        "आर्द्रां य: करिणीं यष्टीं सुवर्णां हेममालिनीम्।",
        "सूर्यां हिरण्मयीं लक्ष्मी जातवेदो म आवह ॥१४॥"
      ]
    },
    {
      "type": "verse",
      "number": "१५",
      "lines": [
        "तां म आवह जातवेदो लक्ष्मीमनपगामिनीम्।",
        "यस्यां हिरण्यं प्रभूतं गावो दास्योश्वान् विन्देयं पुरुषानहम् ॥१५॥"
      ]
    },
    {
      "type": "verse",
      "number": "१६",
      "lines": [
        "य: शुचि: प्रयतोभूत्वा जुहुयाादाज्यमन्वहम्।",
        "सूक्तं पञ्चदशर्च च श्रीकाम: सततं जपेत् ॥१६॥"
      ]
    },
    {
      "type": "verse",
      "number": "१७",
      "lines": [
        "पद्मानने पद्मउरू पद्माक्षि पद्मसंभवे।",
        "तन्मे भजसि पद्मक्षि येन सौख्यं लभाम्यहम् ॥१७॥"
      ]
    },
    {
      "type": "verse",
      "number": "१८",
      "lines": [
        "अश्वदायै गोदायै धनदायै महाधने।",
        "धनं मे लभतां देवि सर्वकामांश्च देहि मे ॥१८॥"
      ]
    },
    {
      "type": "verse",
      "number": "१९",
      "lines": [
        "पद्मानने पद्मविपत्रे पद्मप्रिये पद्मदलायताक्षि।",
        "विश्वप्रिये विष्णुमनोनुकूले त्वत्पादपद्मं मयि संनिधस्त्वं ॥१९॥"
      ]
    },
    {
      "type": "verse",
      "number": "२०",
      "lines": [
        "पुत्रपौत्रं धनंधान्यं हस्ताश्वादिगवेरथम्।",
        "प्रजानां भवसि माता आयुष्मन्तं करोतु मे ॥२०॥"
      ]
    },
    {
      "type": "verse",
      "number": "२१",
      "lines": [
        "धनमग्निर्धनं वायुर्धनं सूर्योधनं वसु।",
        "धनमिन्द्रो बृहस्पतिर्वरूणं धनमस्तु मे ॥२१॥"
      ]
    },
    {
      "type": "verse",
      "number": "२२",
      "lines": [
        "वैनतेय सोमं पिब सोमं पिबतु वृतहा।",
        "सोमं धनस्य सोमिनो मह्यं ददातु सोमिन: ॥२२॥"
      ]
    },
    {
      "type": "verse",
      "number": "२३",
      "lines": [
        "न क्रोधो न च मात्सर्य न लोभो नाशुभामति:।",
        "भवन्ति कृतपुण्यानां भक्तानां श्रीसूक्तं जपेत् ॥२३॥"
      ]
    },
    {
      "type": "verse",
      "number": "२४",
      "lines": [
        "सरसिजनिलये सरोजहस्ते धवलतरांसुकगन्धमाल्यशोभे।",
        "भगवति हरिवल्लभे मनोज्ञे त्रिभुवनभूतिकरि प्रसीदमह्यम् ॥२४॥"
      ]
    },
    {
      "type": "verse",
      "number": "२५",
      "lines": [
        "विष्णुपत्नीं क्षमां देवी माधवी माधवप्रियाम्।",
        "लक्ष्मीं प्रियसखीं देवीं नमाम्यच्युतवल्लभाम् ॥२५॥"
      ]
    },
    {
      "type": "verse",
      "number": "२६",
      "lines": [
        "महालक्ष्मी च विद्महे विष्णुपत्नी च धीमहि।",
        "तन्नो लक्ष्मी: प्रचोदयात् ॥२६॥"
      ]
    },
    {
      "type": "verse",
      "number": "२७",
      "lines": [
        "श्रीवर्चस्वमायुष्यमारोग्यमाविधाच्छोभमानं महीयते।",
        "धान्यं धनं पशुं बहुपुत्रलाभं शतसंवत्सरं दीर्घमायु: ॥२७॥"
      ]
    },
    {
      "type": "mantra",
      "lines": [
        "ॐ शान्तिः शान्तिः शान्तिः ॥"
      ]
    },
    {
      "type": "note",
      "lines": [
        "॥ इति श्रीसूक्तं समाप्तम् ॥"
      ]
    }
  ]
}
