{
  "id": "bagalamukhi-stotram",
  "title": "श्रीबगला(वल्गा)मुखीस्तोत्रम्",
  "language": "sa",
  "script": "Devanagari",
  "category": "stotra",
  "kadhi": "",
  "verification": {
    "status": "draft",
    "verifiedBy": "",
    "verifiedDate": "",
    "sourceCompared": false
  },
  "source": {
    "label": "वापरकर्त्याने अपलोड केलेली bagalAmukhIstotram.pdf (sanskritdocuments.org, रुद्रयामल तंत्र; transliterated/proofread by Ravin Bhalekar) — नित्यसेवा पोथीचा फोटो नाही, स्वतंत्रपणे पाठवलेला मुद्रित/proofread ग्रंथ. वल्गा सूक्तापेक्षा वेगळा ग्रंथ आहे (तेच नाव, वेगळी रचना); सेवापुस्तिकेतील क्रमांक अजून माहीत नाही.",
    "pages": [],
    "images": []
  },
  "uncertainReadings": [
    {
      "location": "संपूर्ण स्तोत्र",
      "possibilities": [
        "PDF मधील मूळ मजकूर जसाच्या तसा उतरवला आहे; काही ओळींच्या शेवटी PDF च्या line-wrap मुळे शेवटचा शब्द दोनदा आलेला होता (उदा. 'स्तम्भिनीम् ॥विमुखवाङ्मनस्स्तम्भिनीम् १॥') — तो तांत्रिक extraction-दोष वगळला आहे, अन्यथा मजकूर बदललेला नाही."
      ],
      "confidence": "medium",
      "requiresHumanReview": true
    },
    {
      "location": "सेवापुस्तिकेतील क्रमांक व कधी म्हणावे",
      "possibilities": [
        "हा ग्रंथ केंद्राच्या नित्यसेवा पोथीत आहे की नाही, असल्यास कितव्या क्रमांकावर व कोणत्या वारी — हे केंद्राने ठरवावे."
      ],
      "confidence": "low",
      "requiresHumanReview": true
    }
  ],
  "sections": [
    { "type": "heading", "lines": ["श्रीबगला(वल्गा)मुखीस्तोत्रम्"] },
    { "type": "mantra", "lines": ["श्रीगणेशाय नमः ।"] },
    { "type": "verse", "number": "१", "lines": [
      "चलत्कनककुण्डलोल्लसितचारुगण्डस्थलीं",
      "लसत्कनकचम्पकद्युतिमदिन्दुबिम्बाननाम् ।",
      "गदाहतविपक्षकां कलितलोलजिह्वांचलां",
      "स्मरामि बगलामुखीं विमुखवाङ्मनस्स्तम्भिनीम् ॥१॥"
    ] },
    { "type": "verse", "number": "२", "lines": [
      "पीयूषोदधिमध्यचारुविलद्रक्तोत्पले मण्डपे",
      "सत्सिंहासनमौलिपातितरिपुं प्रेतासनाध्यासिनीम् ।",
      "स्वर्णाभां करपीडितारिरसनां भ्राम्यद्गदां विभ्रतीमित्थं",
      "ध्यायति यान्ति तस्य सहसा सद्योऽथ सर्वापदः ॥२॥"
    ] },
    { "type": "verse", "number": "३", "lines": [
      "देवि त्वच्चरणाम्बुजार्चनकृते यः पीतपुष्पाञ्जलीन्भक्त्या",
      "वामकरे निधाय च मनुं मन्त्री मनोज्ञाक्षरम् ।",
      "पीठध्यानपरोऽथ कुम्भकवशाद्बीजं स्मरेत्पार्थिवं",
      "तस्यामित्रमुखस्य वाचि हृदये जाड्यं भवेत्तत्क्षणात् ॥३॥"
    ] },
    { "type": "verse", "number": "४", "lines": [
      "वादी मूकति रङ्कति क्षितिपतिर्वैश्वानरः शीतति क्रोधी",
      "शाम्यति दुर्जनः सुजनति क्षिप्रानुगः खञ्जति ।",
      "गर्वी खर्वति सर्वविच्च जडति त्वन्मन्त्रिणा यन्त्रितः",
      "श्रीर्नित्ये बगलामुखि प्रतिदिनं कल्याणि तुभ्यं नमः ॥४॥"
    ] },
    { "type": "verse", "number": "५", "lines": [
      "मन्त्रस्तावदलं विपक्षदलने स्तोत्रं पवित्रं च ते",
      "यन्त्रं वादिनियन्त्रणं त्रिजगतां जैत्रं च चित्रं च ते ।",
      "मातः श्रीबगलेति नाम ललितं यस्यास्ति जन्तोर्मुखे",
      "त्वन्नामग्रहणेन संसदि मुखे स्तम्भो भवेद्वादिनाम् ॥५॥"
    ] },
    { "type": "verse", "number": "६", "lines": [
      "दुष्टस्तम्भनमुग्रविघ्नशमनं दारिद्र्यविद्रावणं",
      "भूभृत्सन्दमनं चलन्मृगदृशां चेतःसमाकर्षणम् ।",
      "सौभाग्यैकनिकेतनं समदृशः कारुण्यपूर्णेक्षणम्",
      "मृत्योर्मारणमाविरस्तु पुरतो मातस्त्वदीयं वपुः ॥६॥"
    ] },
    { "type": "verse", "number": "७", "lines": [
      "मातर्भञ्जय मद्विपक्षवदनं जिह्वां च सङ्कीलय",
      "ब्राह्मीं मुद्रय दैत्यदेवधिषणामुग्रां गतिं स्तंभय ।",
      "शत्रूंश्चूर्णय देवि तीक्ष्णगदया गौराङ्गि पीताम्बरे",
      "विघ्नौघं बगले हर प्रणमतां कारुण्यपूर्णेक्षणे ॥७॥"
    ] },
    { "type": "verse", "number": "८", "lines": [
      "मातर्भैरवि भद्रकालि विजये वाराहि विश्वाश्रये",
      "श्रीविद्ये समये महेशि बगले कामेशि वामे रमे ।",
      "मातङ्गि त्रिपुरे परात्परतरे स्वर्गापवर्गप्रदे",
      "दासोऽहं शरणागतः करुणया विश्वेश्वरि त्राहि माम् ॥८॥"
    ] },
    { "type": "verse", "number": "९", "lines": [
      "संरम्भे चौरसङ्घे प्रहरणसमये बन्धने व्याधिमध्ये",
      "विद्यावादे विवादे प्रकुपितनृपतौ दिव्यकाले निशायाम् ।",
      "वश्ये वा स्तम्भने वा रिपुवधसमये निर्जने वा वने वा",
      "गच्छंस्तिष्ठंस्त्रिकालं यदि पठति शिवं प्राप्नुयादाशु धीरः ॥९॥"
    ] },
    { "type": "verse", "number": "१०", "lines": [
      "त्वं विद्या परमा त्रिलोकजननी विघ्नौघसंछेदिनी",
      "योषित्कर्षणकारिणी जनमनःसम्मोहसन्दायिनी ।",
      "स्तम्भोत्सारणकारिणी पशुमनःसम्मोहसन्दायिनी",
      "जिह्वाकीलनभैरवी विजयते ब्रह्मादिमन्त्रो यथा ॥१०॥"
    ] },
    { "type": "verse", "number": "११", "lines": [
      "विद्या लक्ष्मीर्नित्यसौभाग्यमायुः पुत्रैः पौत्रैः सर्वसाम्राज्यसिद्धिः ।",
      "मानो भोगो वश्यमारोग्यसौख्यं प्राप्तं तत्तद्भूतलेऽस्मिन्नरेण ॥११॥"
    ] },
    { "type": "verse", "number": "१२", "lines": [
      "त्वत्कृते जपसन्नाहं गदितं परमेश्वरि ।",
      "दुष्टानां निग्रहार्थाय तद्गृहाण नमोऽस्तु ते ॥१२॥"
    ] },
    { "type": "verse", "number": "१३", "lines": [
      "पीताम्बरां च द्विभुजां त्रिनेत्रां गात्रकोमलाम् ।",
      "शिलामुद्गरहस्तां च स्मरे तां बगलामुखीम् ॥१३॥"
    ] },
    { "type": "verse", "number": "१४", "lines": [
      "ब्रह्मास्त्रमिति विख्यातं त्रिषु लोकेषु विश्रुतम् ।",
      "गुरुभक्ताय दातव्यं न देयं यस्य कस्यचित् ॥१४॥"
    ] },
    { "type": "verse", "number": "१५", "lines": [
      "नित्यं स्तोत्रमिदं पवित्रमिह यो देव्याः पठत्यादराद्धृत्वा",
      "यन्त्रमिदं तथैव समरे बाहौ करे वा गले ।",
      "राजानोऽप्यरयो मदान्धकरिणः सर्पा मृगेन्द्रादिकास्ते",
      "वै यान्ति विमोहिता रिपुगणा लक्ष्मीः स्थिरा सिद्धयः ॥१५॥"
    ] },
    { "type": "phalashruti", "lines": ["॥ इति श्रीरुद्रयामले तन्त्रे श्रीबगलामुखीस्तोत्रं समाप्तम् ॥"] }
  ]
}
